{
  "schemaVersion": "tigerkit.execute-support-matrix/v1",
  "pluginVersion": "16.3.0",
  "generatedAt": "2026-07-02T00:00:00Z",
  "environments": [
    {
      "environmentKey": "claude-code/linux/local/default",
      "status": "public",
      "boundaryArchitecture": "hook_gate",
      "boundaryComponents": [
        "hooks/hooks.json",
        "hooks/execute-write-boundary.py"
      ],
      "reason": "Legacy packaging metadata only. Active /tk surface no longer exposes execute."
    }
  ]
}
